{
    "$schema": "https://json-schema.org/draft/2020-12/schema",
    "$id": "config.schema.json",
    "title": "Proto-Testbed Config",
    "description": "Testbed config for a Proto-Testbed setup package",
    "type": "object",
    "properties": {
        "settings": {
            "type": "object",
            "properties": {
                "management_network": {
                    "type": [
                        "string",
                        "null"
                    ]
                },
                "diskimage_basepath": {
                    "type": "string"
                },
                "startup_init_timeout": {
                    "type": "number"
                },
                "experiment_timeout": {
                    "type": "number"
                }
            },
            "additionalItems": false
        },
        "networks": {
            "type": "array",
            "items": {
                "type": "object",
                "properties": {
                    "name": {
                        "type": "string"
                    },
                    "host_ports": {
                        "type": "array",
                        "items": {
                            "type": [
                                "string",
                                "null"
                            ]
                        }
                    }
                },
                "additionalItems": false,
                "required": [
                    "name",
                    "host_ports"
                ]
            }
        },
        "integrations": {
            "type": "array",
            "items": {
                "type": "object",
                "properties": {
                    "name": {
                        "type": "string"
                    },
                    "type": {
                        "type": "string"
                    },
                    "environment": {
                        "type": [
                            "object",
                            "null"
                        ]
                    },
                    "invoke_after": {
                        "type": "string",
                        "enum": [
                            "startup",
                            "network",
                            "init"
                        ]
                    },
                    "wait_after_invoke": {
                        "type": "number"
                    },
                    "settings": {
                        "type": "object"
                    }
                },
                "additionalItems": false,
                "required": [
                    "name",
                    "type",
                    "invoke_after",
                    "settings"
                ]
            }
        },
        "instances": {
            "type": "array",
            "items": {
                "type": "object",
                "properties": {
                    "name": {
                        "type": "string"
                    },
                    "diskimage": {
                        "type": "string"
                    },
                    "setup_script": {
                        "type": [
                            "string",
                            "null"
                        ]
                    },
                    "environment": {
                        "type": [
                            "object",
                            "null"
                        ]
                    },
                    "cores": {
                        "type": "number"
                    },
                    "memory": {
                        "type": "number"
                    },
                    "networks": {
                        "oneOf": [
                            {
                                "type": "null"
                            },
                            {
                                "type": "array",
                                "items": {
                                    "oneOf": [
                                        {
                                            "type": "string"
                                        },
                                        {
                                            "type": "object",
                                            "properties": {
                                                "name": {
                                                    "type": "string"
                                                },
                                                "mac": {
                                                    "type": "string"
                                                },
                                                "netmodel": {
                                                    "type": "string",
                                                    "enum": [
                                                        "virtio",
                                                        "e1000",
                                                        "rtl8139"
                                                    ]
                                                }
                                            },
                                            "required": [
                                                "name"
                                            ],
                                            "additionalItems": false
                                        }
                                    ]
                                }
                            }
                        ]
                    },
                    "preserve_files": {
                        "type": "array",
                        "items": {
                            "type": "string"
                        }
                    },
                    "applications": {
                        "type": [
                            "array",
                            "null"
                        ],
                        "items": {
                            "type": "object",
                            "properties": {
                                "application": {
                                    "type": "string"
                                },
                                "name": {
                                    "type": "string"
                                },
                                "delay": {
                                    "type": "number"
                                },
                                "runtime": {
                                    "type": ["number", "null"]
                                },
                                "dont_store": {
                                    "type": "boolean"
                                },
                                "load_from_instance": {
                                    "type": "boolean"
                                },
                                "settings": {
                                    "type": "object"
                                }
                            },
                            "required": [
                                "application",
                                "name",
                                "runtime",
                                "settings"
                            ],
                            "additionalItems": false
                        }
                    }
                },
                "additionalItems": false,
                "required": [
                    "name",
                    "diskimage",
                    "setup_script",
                    "environment",
                    "networks",
                    "applications"
                ]
            }
        }
    },
    "required": [
        "settings",
        "networks",
        "integrations",
        "instances"
    ],
    "additionalItems": false
}
